{
  "task_id": "FRONT-PJT-CASE-04-MTG-CASE-04-04",
  "evaluation_target": {
    "manager_id": "MGR-CASE-04",
    "manager_name": "陈昊",
    "project_id": "PJT-CASE-04",
    "evaluation_period": "2026-04-13 ~ 2026-04-24",
    "current_meeting_id": "MTG-CASE-04-04"
  },
  "trigger_context": {
    "trigger_type": "manual",
    "report_type": "single",
    "audience": [
      "pmo",
      "manager"
    ]
  },
  "source_config": {
    "source_mode": "case04_sample_bundle",
    "bundle_path": "D:\\Users\\HCI_lab\\Desktop\\github\\飞书比赛\\samples\\feishu_cli_case_04_simulated_5d"
  }
}